{"schemaVersion":"dromio.context-snapshot.v1","id":"snapshot-1","executionRunId":"run-1","threadId":"thread-1","turnId":"turn-1","threadSequence":2,"modelId":"provider/model","itemRevisionIds":["revision-1"],"instructionRevisionIds":[],"summaryIds":[],"tokenBudget":8192,"estimatedTokens":12,"policyVersion":"policy-1","entries":[{"source":{"type":"item_revision","id":"revision-1"},"role":"user","content":[{"type":"text","text":"Hello"}],"estimatedTokens":12}],"createdAt":"2026-01-01T00:00:00Z"}
